title,overview,url,crawling_date,시작일,종료일,국가,분야/분류,참가기업 수,총 방문자 수,전시장,전시회 홈페이지
인도 뭄바이 종합 전시회 [India Big7 Expo],"India Big 7은 선물, 문방구, 필기구, 사무용품, 가제트, 가정용품, 주방용품 및 가정 장식, 라이프스타일, 의류, 수하물, 식품, 제과, 미용, 건강 및 웰빙 산업에 관한 인도 최대 규모의 무역 행사입니다. 지난 28년 동안 업계에 서비스를 제공한 India Big 7은 전체 솔루션 범위를 통합하고 제조업체, 상인, 도매업체, 재고 판매업체, 기업 구매자가 한 곳에서 비즈니스를 수행할 수 있도록 하는 인도의 선도적이고 신뢰할 수 있는 네트워킹 플랫폼으로 부상했습니다. 선물 및 문구 산업은 인도 및 해외에서 많은 새로운 플레이어가 진입하면서 엄청나게 성장했습니다.",https://contentour.co.kr/%EC%A0%84%EC%8B%9C%ED%9A%8C-%EC%A0%95%EB%B3%B4/%ED%95%B4%EC%99%B8%EC%A0%84%EC%8B%9C%ED%9A%8C/?mod=document&category1=%EA%B5%AD%EA%B0%80%EC%A2%85%ED%95%A9%EC%A0%84%EC%8B%9C%ED%9A%8C&category2=%EC%9D%B8%EB%8F%84&uid=4501,2024-07-22,2024-06-06,2024-06-08,인도,국가종합전시회,348+,"1,000+","JIO World Convention Centre, Mumbai",https://www.indiabig7.com/
인도 뉴델리 식품 전시회 [SIAL Food India]," ""SIAL India""는 인도에서 개최되는 식품 및 음료 산업을 위한 국제 전시회로서, 다양한 식품 및 음료 제품, 기술, 서비스를 소개하는 행사입니다. 이 박람회는 매년 인도의 다양한 도시에서 개최되며, 전세계의 식품 및 음료 업계 기업들과 전문가들이 모여 최신 동향을 공유하고 비즈니스 네트워킹 기회를 제공하는 플랫폼 역할을 합니다.",https://contentour.co.kr/%EC%A0%84%EC%8B%9C%ED%9A%8C-%EC%A0%95%EB%B3%B4/%ED%95%B4%EC%99%B8%EC%A0%84%EC%8B%9C%ED%9A%8C/?mod=document&category1=%EC%8B%9D%ED%92%88%2F%EC%9D%8C%EB%A3%8C%2F%ED%98%B8%ED%85%94%2F%ED%94%84%EB%A0%8C%EC%B0%A8%EC%9D%B4%EC%A6%88&category2=%EC%9D%B8%EB%8F%84&uid=2764,2024-07-22,2024-12-05,2024-12-07,인도,식품/음료/호텔/프렌차이즈,300+,"10,000+",Pragati Maidan Exhibition Center,https://imexmanagement.com/shows/sial-india-2024
인도 뭄바이 식품 전시회 [Annapoorna ANUFOOD India],"Annapoorna - ANUFOOD India는 인도 아대륙의 식음료 무역 및 소매 시장을 위한 가장 중요한 B2B 플랫폼입니다. 식음료 무역 및 소매 시장에 관한 인도의 국제 전시회는 Koelnmesse YA Tradefair Pvt.가 공동으로 주최합니다. Ltd. 및 인도 상공회의소 연합(FICCI). ANUTEC- International FoodTec India, PackEx India, Food Logistics India 및 ANUTEC - Ingredients India의 동시 무역 박람회와 함께 인도 뭄바이 센터.",https://contentour.co.kr/%EC%A0%84%EC%8B%9C%ED%9A%8C-%EC%A0%95%EB%B3%B4/%ED%95%B4%EC%99%B8%EC%A0%84%EC%8B%9C%ED%9A%8C/?mod=document&category1=%EC%8B%9D%ED%92%88%2F%EC%9D%8C%EB%A3%8C%2F%ED%98%B8%ED%85%94%2F%ED%94%84%EB%A0%8C%EC%B0%A8%EC%9D%B4%EC%A6%88&category2=%EC%9D%B8%EB%8F%84&uid=2437,2024-07-22,2024-08-28,2024-08-30,인도,식품/음료/호텔/프렌차이즈,200+,"7,000+","Bombay Exhibition Centre, Mumbai, India",https://www.anufoodindia.com/
인도 뉴델리 국제 식품 기술 및 기계 전시회 [AN UTEC-International FoodTec INDIA],"""AN UTEC-International FoodTec INDIA""는 인도의 뉴델리에서 개최되는 국제적인 식품 기술 및 기계 전시회로, 식품 및 음료 산업에서의 기술 혁신과 전문 지식을 공유하는 플랫폼으로서 중요한 역할을 합니다. 이 박람회는 식품 가공, 생산, 포장 및 기술 분야에 관한 혁신적인 제품 및 서비스를 제공하며, 인도의 식품 산업에 대한 정보 및 기술 교류의 기회를 제공합니다. ",https://contentour.co.kr/%EC%A0%84%EC%8B%9C%ED%9A%8C-%EC%A0%95%EB%B3%B4/%ED%95%B4%EC%99%B8%EC%A0%84%EC%8B%9C%ED%9A%8C/?mod=document&category1=%EC%8B%9D%ED%92%88%2F%EC%9D%8C%EB%A3%8C%2F%ED%98%B8%ED%85%94%2F%ED%94%84%EB%A0%8C%EC%B0%A8%EC%9D%B4%EC%A6%88&category2=%EC%9D%B8%EB%8F%84&uid=2440,2024-07-22,2024-08-28,2024-08-30,인도,식품/음료/호텔/프렌차이즈,400+,"10,000+","Bombay Exhibition Centre, Mumbai",https://anutecindia.com/
인도 뉴델리 유기농 박람회 [BioFach India],"BIOFACH INDIA는 인도 유기농 산업에서 입지를 확고히 했으며 매 판마다 전시회는 새로운 기준을 제시합니다. 매년 인도의 유기농 산업을 위한 가장 큰 플랫폼은 우수한 비즈니스 거래, 탁월한 투자 환경, 매우 유망한 연락처 및 높은 수준의 비즈니스 네트워킹을 봅니다. 유럽, 미국, 중동 및 동남아시아의 바이어들이 행사에 참석하여 인도 시장의 조달 소스를 살펴봅니다. BIOFACH INDIA - NürnbergMesse India가 주최하는 인도 유기농 산업을 위한 박람회입니다. 이 행사는 농업 및 가공 식품 수출 개발청(APEDA), 상공부, 인도 정부의 후원 하에 개최되며 단일 플랫폼에서 유기농 및 천연 산업의 모든 주요 업체를 연결하는 것을 목표로 합니다.",https://contentour.co.kr/%EC%A0%84%EC%8B%9C%ED%9A%8C-%EC%A0%95%EB%B3%B4/%ED%95%B4%EC%99%B8%EC%A0%84%EC%8B%9C%ED%9A%8C/?mod=document&category1=%EC%8B%9D%ED%92%88%2F%EC%9D%8C%EB%A3%8C%2F%ED%98%B8%ED%85%94%2F%ED%94%84%EB%A0%8C%EC%B0%A8%EC%9D%B4%EC%A6%88&category2=%EC%9D%B8%EB%8F%84&uid=2444,2024-07-22,2024-08-03,2024-08-05,인도,식품/음료/호텔/프렌차이즈,200+,"10,000+","India Expo Mart (IEML), Greater Noida, Delhi-NCR",https://biofach-india.com/home
인도 뭄바이 기능성 식품 전시회 [Nutrify Today’s C-Suite Sumflex],"Nutrify Today’s C-Suite Sumflex는 인도 뭄바이에서 열리는 선진적인 기능성 식품 및 건강 관련 제품의 전시회입니다. 이 행사는 건강에 관심이 있는 소비자와 전문가들을 대상으로 기능성 식품 및 보충제의 최신 동향을 소개하고, 새로운 제품 및 기술을 발견할 수 있는 플랫폼을 제공합니다. ",https://contentour.co.kr/%EC%A0%84%EC%8B%9C%ED%9A%8C-%EC%A0%95%EB%B3%B4/%ED%95%B4%EC%99%B8%EC%A0%84%EC%8B%9C%ED%9A%8C/?mod=document&category1=%EC%8B%9D%ED%92%88%2F%EC%9D%8C%EB%A3%8C%2F%ED%98%B8%ED%85%94%2F%ED%94%84%EB%A0%8C%EC%B0%A8%EC%9D%B4%EC%A6%88&category2=%EC%9D%B8%EB%8F%84&uid=6404,2024-07-22,2024-06-06,2024-06-07,인도,식품/음료/호텔/프렌차이즈,200+,"3,000+",The Taj Mahal Palace,https://www.nutrifycsuite.com/index.html
인도 뉴델리 식품박람회 [AAHAR],인도의 수도 뉴델리에서 매년 개최되는 인도 뉴델리 식품박람회 [AAHAR]는 인도의 식품 및 조리 산업에 중요한 전시회로 자리잡고 있습니다. 이 박람회는 국내 및 국제적인 식품 및 음료 업계의 주요 인물들을 모아 새로운 제품과 기술을 소개하고 비즈니스 네트워킹의 기회를 제공합니다. ,https://contentour.co.kr/%EC%A0%84%EC%8B%9C%ED%9A%8C-%EC%A0%95%EB%B3%B4/%ED%95%B4%EC%99%B8%EC%A0%84%EC%8B%9C%ED%9A%8C/?mod=document&category1=%EC%8B%9D%ED%92%88%2F%EC%9D%8C%EB%A3%8C%2F%ED%98%B8%ED%85%94%2F%ED%94%84%EB%A0%8C%EC%B0%A8%EC%9D%B4%EC%A6%88&category2=%EC%9D%B8%EB%8F%84&uid=6503,2024-07-22,2024-03-07,2024-03-11,인도,식품/음료/호텔/프렌차이즈,200+,"3,000+",Pragati Maidan,https://indiatradefair.com/aahardelhi//
인도 첸나이 푸드 스타일 엑스포 [Food Style Expo], Food Style Expo India 2021 은 글로벌 식품 제조업체가 세계 최대 식품 시장 중 하나에 진입할 수 있는 완벽한 관문입니다. Food Style Expo India 2021은 남인도에서 가장 큰 Food Style Expo India 2021 전시회가 될 것이며 인도와 남아시아 전체의 식품 시장에 문을 엽니다.,https://contentour.co.kr/%EC%A0%84%EC%8B%9C%ED%9A%8C-%EC%A0%95%EB%B3%B4/%ED%95%B4%EC%99%B8%EC%A0%84%EC%8B%9C%ED%9A%8C/?mod=document&category1=%EC%8B%9D%ED%92%88%2F%EC%9D%8C%EB%A3%8C%2F%ED%98%B8%ED%85%94%2F%ED%94%84%EB%A0%8C%EC%B0%A8%EC%9D%B4%EC%A6%88&category2=%EC%9D%B8%EB%8F%84&uid=2953,2024-07-22,2021-10-23,2021-10-25,인도,식품/음료/호텔/프렌차이즈,100+,"20,000+",Chennai Trade Centre,https://www.saiexpo.org/index.php
